{
    "$schema": "http://json-schema.org/draft-07/schema#",
    "version": "1.0.0",
    "type": "object",
    "properties": {
        "id": { "type": "string" },
        "name": { "type": "string" },
        "root": { "type": "string", "format": "email" },
        "email": { "type": "string", "format": "email" },
        "scope": {
            "type": "object",
            "properties": {
                "external": { "type": "boolean" },
                "third_party": { "type": "boolean" },
                "organizations": {
                    "type": "array",
                    "items": { "type": "string" }
                }
            },
            "required": ["external", "third_party", "organizations"]
        },
        "advisories": { "type": "string", "format": "uri" }
    },
    "required": ["id", "name", "root", "email", "scope"]
}

