{
    "id": "PureStorage",
    "name": "Pure Storage, Inc.",
    "root": "cve@mitre.org",
    "email": "psirt@purestorage.com",
    "scope": {
        "external": false,
        "third_party": false,
        "organizations": [
            "purestorage"
        ]
    },
    "advisories": "https://support.purestorage.com/bundle/m_security_bulletins/page/Pure_Security/topics/concept/c_security_bulletins.html"
}
