{
    "id": "elastic",
    "name": "Elastic",
    "root": "cve@mitre.org",
    "email": "security@elastic.co",
    "scope": {
        "external": false,
        "third_party": false,
        "organizations": [
            "elastic"
        ]
    },
    "advisories": "https://www.elastic.co/community/security"
}
