{
    "id": "GE_Healthcare",
    "name": "GE Healthcare",
    "root": "ics-cert@hq.dhs.gov",
    "email": "GEHealthcareCVD@ge.com",
    "scope": {
        "external": false,
        "third_party": false,
        "organizations": [
            "gehealthcare"
        ]
    },
    "advisories": "https://www.gehealthcare.com/services/lifecycle-management/product-security-portal/security"
}
