{
    "id": "Sophos",
    "name": "Sophos Limited",
    "root": "cve@mitre.org",
    "email": "security-alert@sophos.com",
    "scope": {
        "external": false,
        "third_party": false,
        "organizations": [
            "sophos",
            "capsule8"
        ]
    },
    "advisories": "https://community.sophos.com/b/security-blog/"
}
