{
    "id": "Swift",
    "name": "Swift Project",
    "root": "cve@mitre.org",
    "email": "cve@forums.swift.org",
    "scope": {
        "external": false,
        "third_party": false,
        "organizations": [
            "apple"
        ]
    },
    "advisories": "https://www.swift.org/support/security.html"
}
