{
    "id": "Temporal",
    "name": "Temporal Technologies Inc.",
    "root": "cve@mitre.org",
    "email": "security@temporal.io",
    "scope": {
        "external": false,
        "third_party": false,
        "organizations": [
            "temporal"
        ]
    },
    "advisories": "https://docs.temporal.io/temporal-technologies-inc-security"
}
