{
    "id": "F5",
    "name": "F5, Inc.",
    "root": "cve@mitre.org",
    "email": "f5sirt@f5.com",
    "scope": {
        "external": false,
        "third_party": true,
        "organizations": [
            "f5",
            "nginx"
        ]
    },
    "advisories": "https://support.f5.com/csp/knowledge-center/security"
}
