{
    "id": "PSF",
    "name": "Python Software Foundation",
    "root": "cve@mitre.org",
    "email": "cna@python.org",
    "scope": {
        "external": false,
        "third_party": false,
        "organizations": [
            "python",
            "pypi",
            "pypa"
        ]
    },
    "advisories": "https://mail.python.org/archives/list/security-announce@python.org/latest"
}
