{
    "id": "sap",
    "name": "SAP SE",
    "root": "cve@mitre.org",
    "email": "cna@sap.com",
    "scope": {
        "external": false,
        "third_party": false,
        "organizations": [
            "sap"
        ]
    },
    "advisories": "https://support.sap.com/en/my-support/knowledge-base/security-notes-news.html"
}
