{
    "id": "openEuler",
    "name": "openEuler",
    "root": "cve@mitre.org",
    "email": "openeuler-security@openeuler.org",
    "scope": {
        "external": false,
        "third_party": false,
        "organizations": [
            "openeuler"
        ]
    },
    "advisories": "https://www.openeuler.org/en/security/security-bulletins/"
}
