{
    "id": "forcepoint",
    "name": "Forcepoint",
    "root": "cve@mitre.org",
    "email": "psirt@forcepoint.com",
    "scope": {
        "external": false,
        "third_party": false,
        "organizations": [
            "forcepoint"
        ]
    },
    "advisories": "https://support.forcepoint.com/s/knowledge-base#t=All&sort=relevancy&f:@sfrecordtypename=[Security%20Advisory]"
}
