{
    "id": "certcc",
    "name": "CERT/CC",
    "email": "cret@cert.org",
    "root": "cve@mitre.org",
    "scope": {
        "external": false,
        "third_party": true,
        "organizations": [
			"apple",
			"microsoft",
			"debian",
			"dell",
			"emc",
			"axis",
			"isc",
			"lenovo",
			"hp",
			"ibm",
			"sonicwall",
			"sap",
			"adobe",
			"intuit",
			"oracle",
			"logitech",
			"novell",
			"corel",
			"cisco",
			"liferay",
			"ge",
			"abb",
			"juniper",
			"foxitsoftware",
			"artifex",
			"rockwellautomation",
			"gnu",
			"vmware",
			"php",
			"xpdfreader",
			"samsung",
			"broadcom",
			"lexmark",
			"siemens",
			"advantech",
			"atvise",
			"schneider-electric",
			"arcinfo",
			"dotcms",
			"forescout",
			"johnsoncontrols",
			"progress",
			"solarwinds",
			"f5",
			"tp-link",
			"smartertools",
			"manageengine",
			"otrs",
			"esri",
			"huawei",
			"fortinet",
			"dlink",
			"zohocorp",
			"freebsd",
			"trendmicro",
			"nlnetlabs",
			"honeywell",
			"apache",
			"nvidia",
			"qnap",
			"avast",
			"zyxel",
			"silabs",
			"att",
			"watchguard",
			"linux",
			"synology",
			"dahuasecurity",
			"moodle",
			"zabbix",
			"silver-peak",
			"autodesk",
			"avg",
			"netgear",
			"navercorp",
			"goabode",
			"avira",
			"ea",
			"alibaba",
			"kingsoft",
			"brocade",
			"toshiba",
			"tianocore",
			"hikvision",
			"linksys",
			"openssl",
			"zte",
			"igniterealtime",
			"google",
			"foscam",
			"westerndigital",
			"zoom",
			"telerik",
			"philips",
			"sierrawireless",
			"hancom",
			"opencv",
			"milesight",
			"lantronix",
			"wso2",
			"hdfgroup",
			"atlassian",
			"chef",
			"crestron",
			"intel",
			"golang",
			"acronis",
			"tibco",
			"pixar",
            "mcafee"
        ]
    },
    "advisories": "https://www.kb.cert.org/vuls/bypublished/desc/"
}
