{
    "id": "OpenBMC",
    "name": "The OpenBMC Project",
    "root": "cve@mitre.org",
    "email": "openbmc-security@lists.ozlabs.org",
    "scope": {
        "external": false,
        "third_party": false,
        "organizations": [
            "openbmc-project"
        ]
    },
    "advisories": "https://github.com/openbmc/openbmc/security/advisories"
}
