{
    "id": "Hillstone",
    "name": "Hillstone Networks Inc.",
    "root": "cve@mitre.org",
    "email": "psirt@hillstonenet.com",
    "scope": {
        "external": false,
        "third_party": false,
        "organizations": [
            "hillstonenet"
        ]
    },
    "advisories": "https://www.hillstonenet.com.cn/support-and-training/psirt/"
}
