{
    "id": "Salesforce",
    "name": "Salesforce.com, Inc.",
    "root": "cve@mitre.org",
    "email": "security@salesforce.com",
    "scope": {
        "external": false,
        "third_party": false,
        "organizations": [
            "salesforce",
            "tableau",
            "mulesoft"
        ]
    },
    "advisories": "https://trust.salesforce.com/en/security/security-advisories/"
}
